{"schema_version":1,"operation_id":"1d9b8abc-e46a-4fec-af45-6eadbfbef592","idempotency_key":"4b0f02dd-c302-493b-8c0b-f253e537d6e8","operation":"record_media_entry","work_ref":{"id":"intouchables-2011"},"create_if_missing":false,"target_updates":[{"target":"primary","rating":{"score":7.5,"source":"explicit","confidence":"exact"}}],"preconditions":{"expected_viewer_digests":{"primary":"sha256:f4846c42e84275273b04b011150c38353f46022f3fef865b8fd3bd635a820cea"}}}
