{"schema_version":1,"operation_id":"ba3c2faf-de0f-47dc-bdd9-13b57a0b7f98","idempotency_key":"5d31586e-5972-499c-8180-f4c24cb52f1f","operation":"record_media_entry","work_ref":{"id":"the-grand-budapest-hotel-2014"},"create_if_missing":false,"target_updates":[{"target":"partner","feedback":{"summary":"Фильм очень понравился, сначала посмотрела его самостоятельно и много смеялась, затем пересмотрела вместе с ним и второй раз тоже смотрела с интересом."}}],"preconditions":{"expected_viewer_digests":{"partner":"sha256:cec6f6d9beb8edc4129d00f2277e07a85b15aece1268ee5f2bd414eca7f2aa28"}}}
