{
  "schema_version": 1,
  "operation_id": "c43a3c49-c8c7-42b4-8b94-85da9a9891c6",
  "idempotency_key": "d9974627-7dc3-4df2-8a8a-a7e57c63e719",
  "operation": "record_media_entry",
  "work_ref": {
    "tmdb_media_type": "movie",
    "tmdb_id": 77338,
    "title": "Intouchables",
    "year": 2011
  },
  "create_if_missing": true,
  "target_updates": [
    {
      "target": "primary",
      "viewing": {
        "status": "watched"
      },
      "rating": {
        "score": 8,
        "source": "explicit_approx",
        "confidence": "medium"
      },
      "reaction": {
        "value": "liked",
        "source": "explicit",
        "confidence": "high"
      },
      "feedback": {
        "summary": "Давно смотрел «1+1» и даже пересматривал несколько раз, когда его показывали по телевидению; подробности сейчас помнит не очень хорошо. В целом хороший, добрый фильм, примерно 7,5–8/10: сочетание драматической истории и комедии с упором на развитие отношений двух главных героев. Напоминает «Зелёную книгу»: в центре оба раза богатый человек, испытывающий определённые сложности, и его наёмный помощник; герои из разных социальных миров постепенно становятся друзьями, переживая события вместе.",
        "signals": [
          {
            "term": "characters.depth",
            "sentiment": "positive",
            "strength": 2,
            "source": "explicit",
            "confidence": "high"
          },
          {
            "term": "entertainment.engaging",
            "sentiment": "positive",
            "strength": 2,
            "source": "explicit",
            "confidence": "high"
          }
        ]
      }
    }
  ],
  "creation_context": {
    "provider_identity": {
      "media_type": "movie",
      "id": 77338
    }
  },
  "semantic_snapshot": {
    "traits": [
      {
        "term": "genre.comedy",
        "source": "external_source",
        "confidence": "exact"
      },
      {
        "term": "genre.drama",
        "source": "external_source",
        "confidence": "exact"
      },
      {
        "term": "characters.depth",
        "source": "llm_inferred",
        "confidence": "high"
      },
      {
        "term": "tone.light",
        "source": "llm_inferred",
        "confidence": "medium"
      },
      {
        "term": "atmosphere.immersive",
        "source": "llm_inferred",
        "confidence": "medium"
      }
    ]
  },
  "preconditions": {
    "expected_viewer_digests": {}
  }
}
