{
  "schema_version": 1,
  "operation_id": "5da172e1-6189-45bd-bc4b-daf515312e10",
  "idempotency_key": "b3794283-fc92-4a9d-9ab4-d7ce7596e802",
  "operation": "record_media_entry",
  "work_ref": {
    "tmdb_media_type": "movie",
    "tmdb_id": 137113,
    "title": "Edge of Tomorrow",
    "year": 2014
  },
  "create_if_missing": true,
  "target_updates": [
    {
      "target": "primary",
      "viewing": {
        "status": "watched"
      },
      "rating": {
        "score": 9,
        "source": "explicit",
        "confidence": "exact"
      },
      "reaction": {
        "value": "liked",
        "source": "explicit",
        "confidence": "high"
      },
      "feedback": {
        "summary": "Очень понравился фильм: хорошая графика, крепкий экшен и интересный сюжет. Особенно удачно показана временная петля; кажется, мне в целом нравятся истории про временные петли. Порадовало, что в итоге вышли на счастливый финал, хотя в какой-то момент ожидал более мрачной развязки. Том Круз хорошо сыграл на протяжении всего фильма. Очень жду вторую часть. После просмотра даже ознакомился с литературным первоисточником.",
        "signals": [
          {
            "term": "visuals.strong",
            "sentiment": "positive",
            "strength": 2,
            "source": "explicit",
            "confidence": "high"
          },
          {
            "term": "action.strong",
            "sentiment": "positive",
            "strength": 3,
            "source": "explicit",
            "confidence": "high"
          },
          {
            "term": "story.intrigue",
            "sentiment": "positive",
            "strength": 2,
            "source": "explicit",
            "confidence": "high"
          },
          {
            "term": "narrative.time_loop",
            "sentiment": "positive",
            "strength": 3,
            "source": "explicit",
            "confidence": "high"
          },
          {
            "term": "story.payoff",
            "sentiment": "positive",
            "strength": 2,
            "source": "explicit",
            "confidence": "high"
          },
          {
            "term": "entertainment.engaging",
            "sentiment": "positive",
            "strength": 3,
            "source": "explicit",
            "confidence": "high"
          }
        ]
      }
    }
  ],
  "creation_context": {
    "provider_identity": {
      "media_type": "movie",
      "id": 137113
    }
  },
  "semantic_snapshot": {
    "traits": [
      {
        "term": "genre.action",
        "source": "external_source",
        "confidence": "exact"
      },
      {
        "term": "genre.science_fiction",
        "source": "external_source",
        "confidence": "exact"
      },
      {
        "term": "narrative.time_loop",
        "source": "llm_inferred",
        "confidence": "high"
      },
      {
        "term": "story.problem_solving",
        "source": "llm_inferred",
        "confidence": "high"
      },
      {
        "term": "pacing.fast",
        "source": "llm_inferred",
        "confidence": "high"
      },
      {
        "term": "story.intrigue",
        "source": "llm_inferred",
        "confidence": "high"
      },
      {
        "term": "content.violence",
        "source": "llm_inferred",
        "confidence": "high"
      }
    ]
  },
  "preconditions": {
    "expected_viewer_digests": {}
  }
}
