{
  "schema_version": 1,
  "operation_id": "6f6ebc3e-35d7-4e69-9c42-2fb2c76d4301",
  "idempotency_key": "4f8be82a-e876-4766-a42c-a0d4e9f3e9e2",
  "operation": "record_media_entry",
  "work_ref": {
    "tmdb_media_type": "movie",
    "tmdb_id": 7551,
    "title": "Déjà Vu",
    "year": 2006
  },
  "create_if_missing": true,
  "target_updates": [
    {
      "target": "primary",
      "viewing": {
        "status": "watched"
      },
      "rating": {
        "score": 7.5,
        "source": "explicit",
        "confidence": "exact"
      },
      "feedback": {
        "summary": "Интересный, хорошо продуманный сюжет с замкнутой временной петлёй. Кажется, в те годы я его уже смотрел, но был не против посмотреть ещё раз. Балл снизил из-за того, что местами тупость двигает сюжет, и визуальная стилистика не впечатлила. В целом фильм неплох для совместного просмотра.",
        "signals": [
          {
            "term": "entertainment.engaging",
            "sentiment": "positive",
            "strength": 2,
            "source": "explicit",
            "confidence": "high"
          },
          {
            "term": "story.logic",
            "sentiment": "mixed",
            "strength": 2,
            "source": "explicit",
            "confidence": "high"
          },
          {
            "term": "visuals.strong",
            "sentiment": "negative",
            "strength": 2,
            "source": "explicit",
            "confidence": "high"
          }
        ]
      }
    },
    {
      "target": "partner",
      "viewing": {
        "status": "watched"
      },
      "rating": {
        "score": 8,
        "source": "explicit",
        "confidence": "exact"
      },
      "reaction": {
        "value": "liked",
        "source": "explicit",
        "confidence": "high"
      },
      "feedback": {
        "summary": "Есть над чем задуматься во время фильма. Ничего не поняла, но мне нравится, когда я ничего не понимаю, потому что муж мне объяснил. Прикольный и интересный; жаль, что не набрал много в прокате.",
        "signals": [
          {
            "term": "entertainment.engaging",
            "sentiment": "positive",
            "strength": 2,
            "source": "explicit",
            "confidence": "high"
          },
          {
            "term": "story.intrigue",
            "sentiment": "positive",
            "strength": 2,
            "source": "explicit",
            "confidence": "high"
          }
        ]
      }
    }
  ],
  "creation_context": {
    "resolved_identity": {
      "format": "movie",
      "title_original": "Déjà Vu",
      "title_ru": "Дежавю",
      "year": 2006,
      "release_date": "2006-11-22",
      "external_ids": {
        "tmdb": {
          "media_type": "movie",
          "id": 7551
        },
        "imdb": "tt0453467"
      }
    },
    "provider_identity": {
      "media_type": "movie",
      "id": 7551
    },
    "minimum_metadata": {
      "genres": [
        "genre.action",
        "genre.thriller",
        "genre.science_fiction"
      ],
      "runtime_min": 126,
      "original_language": "en",
      "countries": [
        "US",
        "GB"
      ],
      "production_status": "completed"
    }
  },
  "semantic_snapshot": {
    "traits": [
      {
        "term": "genre.action",
        "source": "external_source",
        "confidence": "exact"
      },
      {
        "term": "genre.thriller",
        "source": "external_source",
        "confidence": "exact"
      },
      {
        "term": "genre.science_fiction",
        "source": "external_source",
        "confidence": "exact"
      },
      {
        "term": "story.intrigue",
        "source": "llm_inferred",
        "confidence": "high"
      },
      {
        "term": "story.problem_solving",
        "source": "llm_inferred",
        "confidence": "high"
      },
      {
        "term": "story.twists",
        "source": "llm_inferred",
        "confidence": "high"
      },
      {
        "term": "structure.mystery",
        "source": "llm_inferred",
        "confidence": "high"
      },
      {
        "term": "tone.serious",
        "source": "llm_inferred",
        "confidence": "high"
      },
      {
        "term": "content.violence",
        "source": "llm_inferred",
        "confidence": "high"
      }
    ],
    "semantic_input_digest": "sha256:5abab10a9b253c1989acbacc8bbb37c4adf61b0297a48b2b5965e3431bc1f950",
    "vocabulary_digest": "sha256:3a84ed82cd767ea408ae0bd3a08e264bcc82fbc4f7e7c12d4c05b4a26b50c493",
    "algorithm_version": "media-semantic-v1"
  },
  "preconditions": {
    "expected_viewer_digests": {}
  }
}
