{
  "schema_version": 1,
  "operation_id": "68d30a2b-2efa-4ec7-92f3-713714c83959",
  "idempotency_key": "a56cc01d-1966-425f-ab91-731a5dfc600b",
  "operation": "record_media_entry",
  "work_ref": {
    "tmdb_media_type": "movie",
    "tmdb_id": 286217,
    "title": "The Martian",
    "year": 2015
  },
  "create_if_missing": true,
  "target_updates": [
    {
      "target": "primary",
      "viewing": {
        "status": "watched"
      },
      "rating": {
        "score": 9,
        "source": "explicit",
        "confidence": "exact"
      },
      "reaction": {
        "value": "liked",
        "source": "explicit",
        "confidence": "high"
      },
      "feedback": {
        "summary": "Крепко сделанный фильм с интересной историей и очень удачно вплетённым остроумным юмором. Юмор — одна из главных причин, почему фильм так понравился. Было интересно наблюдать за находчивостью главного героя и его решениями.",
        "signals": [
          {
            "term": "humor.witty",
            "sentiment": "positive",
            "strength": 3,
            "source": "explicit",
            "confidence": "high"
          },
          {
            "term": "story.problem_solving",
            "sentiment": "positive",
            "strength": 3,
            "source": "explicit",
            "confidence": "high"
          },
          {
            "term": "entertainment.engaging",
            "sentiment": "positive",
            "strength": 2,
            "source": "explicit",
            "confidence": "high"
          },
          {
            "term": "story.intrigue",
            "sentiment": "positive",
            "strength": 2,
            "source": "explicit",
            "confidence": "high"
          }
        ]
      }
    }
  ],
  "creation_context": {
    "provider_identity": {
      "media_type": "movie",
      "id": 286217
    }
  },
  "semantic_snapshot": {
    "traits": [
      {
        "term": "genre.science_fiction",
        "source": "external_source",
        "confidence": "exact"
      },
      {
        "term": "genre.adventure",
        "source": "external_source",
        "confidence": "exact"
      },
      {
        "term": "genre.drama",
        "source": "external_source",
        "confidence": "exact"
      },
      {
        "term": "story.problem_solving",
        "source": "llm_inferred",
        "confidence": "high"
      },
      {
        "term": "humor.witty",
        "source": "llm_inferred",
        "confidence": "high"
      },
      {
        "term": "story.intrigue",
        "source": "llm_inferred",
        "confidence": "high"
      },
      {
        "term": "pacing.moderate",
        "source": "llm_inferred",
        "confidence": "medium"
      },
      {
        "term": "tone.light",
        "source": "llm_inferred",
        "confidence": "medium"
      }
    ]
  },
  "preconditions": {
    "expected_viewer_digests": {}
  }
}
