{
  "schema_version": 1,
  "operation_id": "f4934307-5252-44dc-a0db-b7cad1080634",
  "idempotency_key": "ad3e63ce-6256-42ab-befc-5901ff75651c",
  "operation": "record_media_entry",
  "work_ref": {
    "tmdb_media_type": "movie",
    "tmdb_id": 454639,
    "title": "Masters of the Universe",
    "year": 2026
  },
  "create_if_missing": true,
  "target_updates": [
    {
      "target": "primary",
      "viewing": {
        "status": "watched"
      },
      "rating": {
        "score": 6,
        "source": "explicit",
        "confidence": "exact"
      },
      "feedback": {
        "summary": "Приятная картинка, но фильм очень детский; один раз посмотреть фоном сойдёт.",
        "signals": [
          {
            "term": "visuals.strong",
            "sentiment": "positive",
            "strength": 2,
            "source": "explicit",
            "confidence": "high"
          }
        ]
      }
    }
  ],
  "creation_context": {
    "resolved_identity": {
      "format": "movie",
      "title_original": "Masters of the Universe",
      "title_ru": "Властелины вселенной",
      "year": 2026,
      "release_date": "2026-06-03",
      "external_ids": {
        "tmdb": {
          "media_type": "movie",
          "id": 454639
        },
        "imdb": "tt0427340"
      }
    },
    "provider_identity": {
      "media_type": "movie",
      "id": 454639
    },
    "minimum_metadata": {}
  },
  "semantic_snapshot": {
    "traits": [
      {
        "term": "genre.action",
        "source": "external_source",
        "confidence": "exact"
      },
      {
        "term": "genre.science_fiction",
        "source": "external_source",
        "confidence": "exact"
      },
      {
        "term": "genre.adventure",
        "source": "llm_inferred",
        "confidence": "high"
      },
      {
        "term": "pacing.fast",
        "source": "llm_inferred",
        "confidence": "medium"
      },
      {
        "term": "tone.light",
        "source": "llm_inferred",
        "confidence": "high"
      },
      {
        "term": "content.violence",
        "source": "llm_inferred",
        "confidence": "medium"
      }
    ],
    "semantic_input_digest": "sha256:4ea8addae804644f6d8583a76660a7585f51dd11ea3c47db63ccdf5a87ee863f",
    "vocabulary_digest": "sha256:3a84ed82cd767ea408ae0bd3a08e264bcc82fbc4f7e7c12d4c05b4a26b50c493",
    "algorithm_version": "media-semantic-v1"
  },
  "preconditions": {
    "expected_viewer_digests": {}
  }
}
