{
  "schema_version": 1,
  "operation_id": "a7a13c8e-17da-4208-b162-69ac5a9af828",
  "idempotency_key": "711304b7-f701-430b-91ac-2bc99382df1b",
  "operation": "record_media_entry",
  "work_ref": {
    "tmdb_media_type": "movie",
    "tmdb_id": 490132,
    "title": "Green Book",
    "year": 2018
  },
  "create_if_missing": true,
  "target_updates": [
    {
      "target": "primary",
      "viewing": {
        "status": "watched"
      },
      "rating": {
        "score": 7.5,
        "source": "explicit",
        "confidence": "exact"
      },
      "reaction": {
        "value": "liked",
        "source": "explicit",
        "confidence": "high"
      },
      "feedback": {
        "summary": "Понравились общая атмосфера фильма, динамика развития отношений между главными героями и развитие их характеров. Интересно показаны исторический период и социальное напряжение, связанное с расовой дискриминацией чернокожих людей. Красивая картинка, атмосферная и хорошая постановка — фильм просто интересно смотреть.",
        "signals": [
          {
            "term": "atmosphere.immersive",
            "sentiment": "positive",
            "strength": 3,
            "source": "explicit",
            "confidence": "high"
          },
          {
            "term": "characters.depth",
            "sentiment": "positive",
            "strength": 3,
            "source": "explicit",
            "confidence": "high"
          },
          {
            "term": "visuals.strong",
            "sentiment": "positive",
            "strength": 2,
            "source": "explicit",
            "confidence": "high"
          },
          {
            "term": "entertainment.engaging",
            "sentiment": "positive",
            "strength": 2,
            "source": "explicit",
            "confidence": "high"
          }
        ]
      }
    }
  ],
  "creation_context": {
    "provider_identity": {
      "media_type": "movie",
      "id": 490132
    }
  },
  "semantic_snapshot": {
    "traits": [
      {
        "term": "genre.drama",
        "source": "external_source",
        "confidence": "exact"
      },
      {
        "term": "genre.comedy",
        "source": "external_source",
        "confidence": "exact"
      },
      {
        "term": "characters.depth",
        "source": "llm_inferred",
        "confidence": "high"
      },
      {
        "term": "tone.light",
        "source": "llm_inferred",
        "confidence": "medium"
      },
      {
        "term": "pacing.moderate",
        "source": "llm_inferred",
        "confidence": "medium"
      }
    ]
  },
  "preconditions": {
    "expected_viewer_digests": {}
  }
}
